asin,title,price_value,rating,helpfulVoteCount,sentiment_score,liked
B0B713424T,SPOSULEI Mens Skiing Jackets with Hoode Snowboarding Waterproof Fleece Liner Coats Windproof Winter Raincoat Multi Pockets,61.98,4.8,9,0.32207119963369957,1
B0B7RKW1X6,On Men's Cloudgo Sneakers,148.89,4.5,15,0.3323041445944407,1
B0B7S9HP64,Women's Maroon Poly Crepe A-line Kurta Set With Dupatta,44.99,4.0,0,0.3491213152539682,1
B0B84WZ5DY,Wrangler Authentics Men's Slim Fit Straight Leg Jean,27.99,4.636363636363637,2,0.2099085485017205,1
B0B883C9XX,Rapoo Men's Winter Ski Snow Jacket Mountain Waterproof Windproof Rain Jacket,62.989999999999995,4.6,2,0.2721215076590076,1
B0BB2JC2QX,ZITY Men's Flannel Hoodie Shirts Casual Button Down Plaid Shirt Jackets for Men Long Sleeve Stylish Hooded with Pocket,19.9951,4.5,0,0.27931722688123245,1
B0BBDTT6D4,KEFITEVD Men's Jacket Casual Windproof Bomber Jackets Full Zip Windbreaker Jackets Warm Winter Padded Coats Bomber Jackets,49.98,4.7,7,0.370795138879798,1
B0BC3PS8XJ,SIRIL Women's Bandhani Printed Chiffon Saree With Blouse(2612S2080_) 5.5 Meters Orange & Red,0.0,4.0,2,0.5361666666666667,1
B0BFCZSBTG,Dokotoo Womens Blouses Fashion Long Sleeve Shirts V Neck Business Casual Tops Spring Summer Outfits 2025,20.99,4.666666666666667,5,0.29533512122797834,1
B0BFDRQLNC,"NORTHYARD Men's Athletic Running Shorts Quick Dry Workout Shorts 7""/ 5""/ 9"" Lightweight Sports Gym Basketball Shorts Hiking",22.0915,4.8,11,0.2478630769230769,1
B0BGJ5XZTQ,ZITY 3 Pack Mens Polo Shirt Short Sleeve Sports Performance Business Casual Golf Shirts for Men Collared Tactical T-Shirts,35.996,4.0,76,0.2296448412698413,1
B0BGSDG377,TELALEO 4/5 Pack Mens Polo Shirts Quick Dry Short Sleeve Golf T Shirt Performance Moisture Wicking Casual Workout,42.997,4.7272727272727275,14,0.3478627082145989,1
B0BGWBQ9VW,Under Armour Boys' Rival Fleece Joggers,29.6226,4.7,0,0.4932857142857143,1
B0BGXTC1FR,V VALANCH Mens Polo Shirts Short Sleeve Moisture Wicking Golf Polo Athletic Collared Shirt Tennis T-Shirt Tops,26.9931,4.7,3,0.4409642857142857,1
B0BHLYZTHH,CUPSHE Women Eyelet Long Sleeve Tops Shirts Dressy Hollow Out Crochet Lace Embroidered Blouses 2025 Fashion,33.99,4.5,53,0.27731115362811787,1
B0BHPRRS6C,adidas Men's Swift Run Sneaker,60.0033,4.7,2,0.3330904882154882,1
B0BHPS8B12,adidas Women's Swift Run Sneaker,60.0033,4.7,8,0.3275164835164835,1
B0BHPSXR7X,adidas Men's Kaptir 3.0 Sneaker,51.6043,4.5,5,0.29451776695526694,1
B0BHPWC1VJ,adidas Men's Racer TR23 Sneaker,43.9045,4.5,14,0.3579241071,1
B0BLKKW3M4,JMIERR Mens Casual Shorts - Cotton Drawstring Summer Beach Stretch Twill Chino Golf Shorts,19.992,4.4,4,0.2471118285123967,1
B0BLRWCWCB,CRZ YOGA Men's Linerless Workout Shorts - 5'' Lightweight Quick Dry for Running Sports Athletic Gym with Pockets,28.0,4.909090909090909,103,0.29804746620255734,1
B0BLVKGCD7,BTFBM Women's Summer Boho Shirt Top Ruffle Short Sleeve Frill Trim Mock Neck Floral Solid 2025 Casual Blouses Shirts Tops,19.9943,4.6,42,0.31333409645909643,1
B0BLYVSVTL,maamgic Men's 5/7 Inseam Shorts Casual Classic Fit Short Men with Multi-Pocket Mens Workout Shorts Hybrid Quick Dry Shorts,27.99,4.6,21,0.15942621151996147,1
B0BM8RKWD2,"The Children's Place Boys' Assorted Everday Short Sleeve Graphic T-Shirts,multipacks",20.37,4.9,0,0.34181155303030303,1
B0BMTMZCHT,Brooks Men’s Trace 3 Neutral Running Shoe,99.95,4.8,6,0.4539416416916417,1
B0BN1PZ1VX,"VOOVEEYA Women's Bootcut Leggings - Bootleg Yoga Pants Flare with 4 Pockets,Tummy Control High Waisted Casual Dress Pants",28.98,4.6,125,0.20133460235233738,1
B0BN28RWW8,DeYashopin Women's Flats Shoes Leisure Shoes Slip On Work Shoes Comfort Walking Shoes,34.171,4.454545454545454,45,0.39885213274607206,1
B0BN39ZRYD,TRENDMALLS Women 's White Georgette Embroidery Sequence Work Lehenga Choli Set with Dupatta For Women,94.0,3.7,10,0.40822916666666664,1
B0BNBBNR98,CUPSHE Women's Mini Dresses Casual Spring V Neck Chiffon Long Peasant Sleeves Flowy Summer Dress,44.99,4.1,187,0.21076053381142662,1
B0BNDCRMP2,The Children's Place Boys' Athletic Basketball Shorts,23.374,4.6,28,0.26729052247355817,1
B0BNF2F5QZ,Indian Women's Navy Blue Woven Design Banarasi Silk Saree with Unstitched Blouse Piece (SOHNA2001_Parent),32.94,3.8,0,0.2510238095238095,1
B0BNHL4VSC,MEROKEETY Women's 2025 Summer Puff Sleeve Smocked Floral Dress Crewneck Lace Flowy Tiered Midi Dresses,48.99,4.2,21,0.28368002831325334,1
B0BNVZFBQX,MAGCOMSEN Men's Winter Coats Water Resistant Ski Snow Jacket Warm Fleece Jacket Parka Raincoats With Multi-Pockets,67.98,4.8,66,0.27005756602854813,1
B0BPF1R8KC,"Champion Men's Classic Everyday Soft, Comfortable T-Shirt (Regular or Big & Tall)",5.4573,4.636363636363637,8,0.3645216172716173,1
B0BPHD8XCN,POLO RALPH LAUREN Slim Fit Undershirt w/Wicking 5-Pack Crews,61.0012,4.8,0,0.3531666666666667,1
B0BPLX5T1S,MAGNIVIT Men's Lightweight Jackets Light Windbreaker Full Zip Up Stylish Golf Coat Business Work Casual Dress,33.98,4.2,0,0.3664880952380952,1
B0BPY4RXD3,Women Rayon Anarkali Embroidered Printed Anarkali Salwar Kameez,45.02,3.888888888888889,16,0.3154596560846561,1
B0BQHVRH11,"HUNGSON Men's Slim Fit Stretch Jeans Ripped Skinny Jeans for Men, Distressed Straight Leg Fashion Comfort Flex Waist Pants",35.99,4.111111111111111,8,0.2981316137089947,1
B0BQQJMVKJ,"Libin Mens Golf Pants Stretch Work Dress Pants 30""/32""/34"" Quick Dry Lightweight Casual Comfy Trousers with Pockets",39.99,4.6,29,0.39752968460111315,1
B0BQQYDHLG,JMIERR Mens Casual Twill Cargo Shorts Cotton Drawstring Classic Cargo Stretch Short with 6 Pockets,20.993,4.5,30,0.3874504304927099,1
B0BQVR9CCL,POLO RALPH LAUREN mens Classic Fit Undershirt W/Wicking Crews 5-pack,69.5,5.0,0,0.37918367346938775,1
B0BQYQGS1R,Timeson Women's Short Sleeve Chiffon Blouses for Office Work Business Attire Collared Shirts,17.991,4.3,20,0.21539987908946237,1
B0BRRTHFMH,Blooming Jelly Women's Dressy Casual Tops Business Work Blouses White Button Down Shirts Cap Sleeve V Neck Tshirt,19.9931,4.6,11,0.3829853123067409,1
B0BRSFKFJ4,PRETTYGARDEN Women's 2025 Summer Satin Dress Elegant Sleeveless Mock Neck Cocktail Party Maxi Dresses,55.989999999999995,4.5,31,0.37012902837902834,1
B0BRVDXXYV,Womens Kanjivaram Banarasi Silk Saree Patola saree with Unstitched blouse piece free,70.0,4.0,8,0.45086111111111105,1
B0BRXJV1PP,ABAFIP Men's Sissy Skirted Thong Panties Bowknot Low Rise G-string Bikini Briefs Underwear with 4 Gaters Belt,17.98,2.857142857142857,16,0.16011904761904758,0
B0BS193562,"Men Ethnic Gold Leaves 100% pure Jacquard Kurta & Aladdin salwar special for EID, In Panjabi Style",45.0025,4.75,2,0.23560606060606057,1
B0BS6G9WG6,KIDMI Women's Suede Clogs Leather Mules Cork Footbed Sandals Potato Shoes with Arch Support,29.999000000000002,4.7,80,0.23289542005613434,1
B0BS9CPLRT,Blooming Jelly Womens Dressy Casual Tops Ruffle Short Sleeve V Neck Shirts Elegant Business Work Blouse,19.9931,4.6,17,0.3597837083551369,1
B0BSF2B5JH,Womens Smocked Cuffed Striped Boyfriend Shirt Casual Collar Long Sleeve Oversized Button Down Blouse Tops with Pocket Shirred,28.99,4.6,77,0.2612372458890316,1
B0BTSFVMKS,Gloria Vanderbilt Women's Amanda Capri Jean Regular,21.6,5.0,0,0.214625850340136,1
B0BTX2DWV1,Women's Cotton Printed Blue Anarkali Kurta With Palazzo & Dupatta,32.98,3.888888888888889,14,0.34836451251927436,1
B0BV257YG8,COOFANDY Men's Linen Shirts Short Sleeve Casual Shirts Button Down Shirt for Men Beach Summer Wedding Shirt,29.9914,4.5,81,0.14483468155551485,1
B0BV7HNMJ2,Steel Blue Cotton Straight Kurta Palazzo Suit Set,0.0,1.0,2,-0.006666667,0
B0BV8JC4SS,True Religion Mens Boxer Briefs Cotton Stretch Underwear for Men Pack of 4,23.9925,4.4,0,0.29500000000000004,1
B0BW7BVZRQ,Women's Kanjivaram Soft Silk Saree With Blouse Piece (Purple) 6.3metres,59.0,4.25,0,0.3729166666666666,1
B0BW8KKPQH,SERNIAL Womens White Tennis Shoes PU Leather Sneakers Casual Walking Shoes for Women,23.3953,4.3,30,0.29065109886190477,1
B0BWNHZCCR,NY Threads Men's Athletic Shorts Quick Dry Loose-Fit Lightweight Running Workout Gym Shorts with Pockets,7.992,4.5,7,0.3000616001645413,1
B0BX3WHZ8R,Skechers Men's Hands Free Slip-ins Summits High Range Sneaker,65.0013,4.8,17,0.308834436805025,1
B0BXSP3W6R,BALENNZ Golf Polos for Men Quick-Dry Athletic Mens Polo Shirts Short Sleeve Summer Casual Moisture Wicking Golf Shirt,59.992200000000004,4.7,7,0.27689285717248674,1
B0BXT8TFGS,MEROKEETY Women's Casual Cap Sleeve Lace Trim V Neck Tops 2025 Summer Loose Tee Shirts Blouse,14.4428,4.4,28,0.29036993695407154,1
B0BY9YZMW6,Skechers Men's Garza Gervin Slip in,79.9911,4.9,16,0.29047413234913233,1
B0BYB5NPFN,Skechers Men's Respected Holmgren Slip in,56.43339999999999,4.8,40,0.31661505196192696,1
B0BYTDW4QR,Brooks Men’s Ghost Max Cushion Neutral Running & Walking Shoe,89.954,4.8,45,0.2720086878807467,1
B0BZ5JBZ3T,adidas Women's Bravada 2.0 Platform Sneaker,42.7039,4.7,27,0.2955270377770377,1
B0BZ5NB719,adidas Women's Cloudfoam Pure Sportswear Sneaker,38.1849,4.444444444444445,40,0.1889279284614932,1
B0BZ76N2MX,PRETTYGARDEN Women's Summer Wrap Maxi Dress Casual Boho Floral V Neck Short Sleeve Ruffle Hem Split Beach Long Dresses,47.99,4.5,22,0.22887808031095572,1
B0BZ92J5MM,Skechers Women's Bobs D'vine-Instant Delight Sneaker,38.9929,3.8,2,0.07666666666666666,1
B0BZP7BQZV,BORIFLORS Women's Sexy Ruched Bodycon Mini Dress Mesh Long Sleeve Club Party Short Dresses,28.792,5.0,5,0.19554673721340388,1
B0BZZ6ZP7B,SHULOOK Womens Slip on Walking Shoes Comfort Lightweight Breathable Sock Shoe Non-Slip Mesh Casual Fashion Tennis Running Sneakers,19.999,4.5,56,0.26142010582010583,1
B0BZZSK8TF,Lacoste Men's Short Sleeved Ribbed Collar Shirt,55.0,4.363636363636363,12,0.46114510489510485,1
B0C1GS1NWD,Dokotoo Womens Dresses 2025 Spring Summer Deep V Neck Elegant Bow tie Mini Dress S-XL,36.995,4.6,163,0.31261045418167266,1
B0C1L9X2Y7,Womens Jeans Mid Waisted Straight Leg Loose Stretchy Lightweight Tummy Control Trendy Jeans for Women 2024,37.9912,4.1,119,0.14600242289753365,1
B0C1SC8PR9,MoFiz Men's Camo Polo Golf Shirt Hiking Dry Fit Short Sleeve T-Shirts Pique Collared Polo Jersey,24.99,4.6,0,0.31171717923280423,1
B0C24NCRHX,The Children's Place Boys' Long Sleeve Thermal Henley Shirt,9.956,4.9,11,0.394125,1
B0C2C66MDB,JomeDesign Womens Tops 3/4 Sleeve Shirts Round Neck Loose Casual Blouses Floral Print Tshirts,12.99,4.833333333333333,2,0.25062830687830684,1
B0C2DFMQ3V,Women's Heavy Cotton Embroidery Work Unstitched Salwar Suit Dress Material With Chanderi Work Dupatta (Free Size),33.98,4.0,0,0.75,1
B0C2JWQNTN,adidas Women's Kaptir Flow Sneaker,38.5257,4.9,51,0.3777764707358222,1
B0C2VD1HN2,Women's Cargo Jeans Pants,36.99,3.7,19,0.16682699938913306,1
B0C2ZSX1RL,Real Essentials 3 Pack: Men's Jersey Cotton Short Sleeve Polo Shirt - Breathable Performance Polo (Available in Big & Tall),30.99,4.1,0,0.2228988997113997,1
B0C38W6M1C,Lepunuo Cargo Pants for Women High Waisted Casual Pants Baggy Stretchy Wide Leg Y2K Streetwear with 6 Pockets,29.99,4.5,108,0.24500404397585504,1
B0C3J6QB6L,"Hanes Boys' Originals Crewneck Undershirts Pack, Stretch Cotton, Black & Assorted, 5-Pack",16.59,4.9,21,0.3015770427489177,1
B0C3L9HJRZ,XZQTIVE 3 Pack Women Belts For Jeans Dresses Pants Ladies Leather Waist Belt with Gold Buckle,21.501,4.6,22,0.43770264202172093,1
B0C49Y4YXF,Alimens & Gentle Men's Plaid Button Down Shirts Cotton Long Sleeve Dress Shirts Regular Fit Gingham Shirts,22.99,4.5,19,0.3253415103415103,1
B0C4T5L78D,Skechers USA Men's Slip-ins: Delson 3.0-Roth Loafer,58.1927,4.9,6,0.35541746031746035,1
B0C5LX7VCQ,"Rameshwaram Fabrics Men's Readymade Elastic Cotton Silk Dhoti for men, Free Size (Ready-to-wear-Dhoti), Cream, 42W x 34L",0.0,4.1,2,0.3898888888555555,1
B0C5N9XPCF,Lee Women's Legendary High Rise Trouser Jean,44.95,4.6,241,0.210385942571473,1
B0C5ZRQS2X,KuaiLu Flip Flops for Women with Arch Support Yoga Mat Comfortable Summer Beach Walking Thong Cushion Sandals Slip On Indoor Outdoor,13.993,4.8,127,0.24998872653217888,1
B0C61X5ZD7,3 Pcs Men's Oversized Heavy Cotton Summer T-Shirts Vintage Tee Loose Fit Short Sleeve Casual Tshirts for Men Women,35.998,4.8,5,0.272789377303663,1
B0C72M9R32,Dokotoo Women's Wrap V Neck Short Flared Sleeve Wedding Guest Dress Smocked Elastic Waist Tiered Belted Ruffle Hem Mini Dress,46.38,4.1,27,0.3353901671245421,1
B0C73MZF8M,LARNMERN Mens Non Slip Work Shoes Slip On Water Resistant Walking Sneakers Zapatos Trabajo Waterproof Food Service Chef Kitchen,49.9,4.4,30,0.27762569143819144,1
B0C7G8SJMS,"Boys Cargo Shorts, Outdoor Quick Dry Hiking Shorts, Lightweight Athletic Short with Zipper Pockets",9.98,4.8,3,0.2728490375365375,1
B0C7HKDQH3,Carhartt Unisex Baby Long-Sleeve Pocket Bodysuit,14.84,5.0,0,0.4337971230492063,1
B0C7Y5S23T,Levi's Men's Carter Nb Sneaker,27.95,4.4,0,0.2049191919191919,1
B0C8GBQ3QS,3 Pack Mens Polo Shirts Short Sleeve Sport Golf Tennis T Shirt Quick Dry Athletic Workout Polo,31.996,5.0,0,0.7,1
B0C8LJ64HH,PURE CHAMP 3Pk Boys Sweatpants Fleece Athletic Workout Kids Clothes Boys Joggers with Zipper Pocket and Drawstring Size 4-20,38.83,4.4,15,0.3489281763987646,1
B0C8MT7B74,"KISAH Men's Indo-Western Kurta Sherwani Churidar Set Cotton Full Sleaves, Straight, Ethnic Wear | Traditional Wear for Men",0.0,1.0,0,0.41666666666666663,0
B0C8MYJMTG,"KISAH Men's Jacquard Indowestern Sherwani & Pajama Set - Regular Fit, Mandarin Collar |Indian Ethnic Wedding & Festive Wear",149.99,4.4,8,0.3122663096615164,1
B0C8MZ6VQ1,KISAH Men's Cream Jacquard Indowestern Sherwani Kurta & Pajama Set – Mandarin Collar | Indian Wedding & Festive Wear,159.992,3.4,11,0.3170555556,1
B0C8NGNT8L,Boy's Cargo Joggers Pants Youth Quick Dry Hiking Lightweight Pants for Sports Outdoor with Zipper Pockets,14.99,4.2,4,0.24348412695555552,1
B0C9C7TKQ7,Mens Casual Short Sleeve Henley Shirts Fashion Button T Shirts with Pocket,14.9925,4.7272727272727275,0,0.4061267653565062,1
B0C9CPWWR1,OIIIO Men's Ripped Slim Fit Straight Leg Jean Denim Pant,28.4711,4.3,2,0.4225833333333333,1
B0CBJH8DMC,Blooming Jelly Women's Dressy Casual Blouses Business Work Tops Long Sleeve V Neck Pleated Shirts 2025 Fall Outfits,25.990999999999996,4.7,13,0.38635560654241974,1
B0CBKCGNFR,Lee Men's Extreme Motion Regular Straight Jean,36.7212,4.8,30,0.15063022859645525,1
B0CBL2WWBG,Lee Men's Legendary Regular Straight Jean,22.6039,4.6,0,0.17087645687645686,1
B0CC2FCKG3,Stretch Mens Dress Shirts Long Sleeve Slim Fit Dress Shirts for Men Muscle Fit Wrinkle Free Button Down Shirt,25.99,4.8,24,0.29626939669199825,1
B0CCT3WHSS,True Classic Mens T-Shirts - Short Sleeve Crew Neck Plain Novelty T Shirt for Men,49.9944,4.454545454545454,28,0.24252331171034783,1
B0CCYJP95Y,Women's Cotton Printed Straight Kurta With Palazzo & Dupatta Set,31.0611,4.0,9,0.23708333341428572,1
B0CD2HNDVG,"KISAH Men's Printed Sherwani Kurta & Pajama Set - Regular Fit, Mandarin Collar| Ethnic Wear Mens Wear",149.99,4.0,0,-0.4,1
B0CD2J212W,"KISAH Men's Printed Sherwani Kurta & Pajama Set - Regular Fit, Mandarin Collar| Ethnic Wear Mens Wear, Blue, 40",149.99,1.0,0,-0.02,0
B0CD2JYPGB,KISAH Men's Jacquard Indowestern Sherwani Kurta & Dhoti Set - Regular Fit|Indian Ethnic & Festive Wear,174.99,3.4,0,0.27231501831501825,1
B0CD2K7KKG,KISAH Men's Jacquard Indowestern Sherwani & Pajama Set - Regular Fit|Indian Ethnic Wedding & Festive Wear for Men,149.99,2.7142857142857144,6,0.1890816326530612,0
B0CD53B24J,Nmoder Women's Casual Wrap Flared Midi Dress Wedding Guest Cocktail Tea Dresses A-Line Swing V-Neck 3/4 Sleeve,36.998,4.4,35,0.2952140349729635,1
B0CGZL5KZR,Brooks Women’s Glycerin 21 Neutral Running Shoe,109.95309999999999,4.9,191,0.22262713827319436,1
B0CJ61N1HW,Skechers Women's Martha Stewart Bobs Sesame By the Bay,47.6623,4.3,51,0.23484555134035084,1
B0CJTZLCQ2,COOFANDY Men's Cuban Guayabera Shirt Short Sleeve Button Down Shirts Casual Summer Beach Linen Shirts,29.99,4.909090909090909,0,0.3337770562770563,1
B0CJWGMKVD,Under Armour Boys' Tech Logo Shorts,11.5142,5.0,8,0.2760780423280423,1
B0CJWNTM1L,Under Armour Boys' Tech Hybrid Print Short Sleeve T Shirt,14.9725,4.8,0,0.48929067460317455,1
B0CKMCTKJ4,adidas Men's Lite Racer Adapt 7.0 Sneaker,39.3944,4.7,31,0.30337918328334995,1
B0CKMDL9T3,adidas Men's Daily 4.0 Sneaker,55.2015,4.888888888888889,5,0.3833850408850409,1
B0CKML13D6,adidas Unisex Adult Samba Indoor Soccer Shoe,73.7718,4.7,40,0.19492909468147562,1
B0CKSXVKCQ,TBMPOY Men's Lightweight Jackets Casual Windbreaker Stylish Light Fall Spring Golf Work Dress Business,43.99,4.5,65,0.336979969765684,1
B0CKTCWQX6,CUPSHE Women's Knit Ruched Mini Fall Dress Smocked Ruffle Hem Crew Neck Long Sleeve Bodycon Casual Summer Autumn Dresses,42.99,5.0,0,0.0,1
B0CL4XJCJW,Genuine Suede Clogs for Women Men Soft Cork Footbed Leather Mules Comfort Potato Shoes with Arch Support,23.9917,4.7,3,0.3735430194805195,1
B0CLL5X2V5,Floerns Men's Slant Pocket Tailored Pants Work Office Fold Pleated Trousers,29.99,3.4,3,0.1295727513227513,1
B0CLL68CBS,Floerns Men's Classic Fit Flat Front Dress Pants Office Business Trousers,39.99,3.8,13,0.276752705656277,1
B0CLQ8TV53,Signature by Levi Strauss & Co Men's Fit Flex Jeans,25.469,4.9,13,0.29440044215044214,1
B0CLQXF321,LOMON 3/4 Length Sleeve Womens Tops Summer Loose V-Neck Eyelet T-Shirts Dressy Casual Ruffle Sleeve Tunic Blouses,14.99,4.4,22,0.2641845238095238,1
B0CLSRB5CF,Columbia Men's Ascender Softshell Jacket,51.3043,4.9,36,0.4586621444863381,1
B0CMXQ3RVS,Dokotoo Women's Short Puff Sleeve Knit Tops 2025 Trendy Crewneck Striped T Shirts Casual Summer Blouses,25.88,5.0,11,0.30196428571428574,1
B0CN2WFJLN,6 Pack Men's Quick Dry Long Sleeve Shirts Moisture Wicking Sun Protection Performance T-Shirt for Casual Workout,39.98,4.9,21,0.3884952380952381,1
B0CN68233N,Floerns Men's Fold Pleated Tailored Pants Work Office Business Trousers Pants,42.99,3.0,6,0.1388333333333333,1
B0CN6BCP5S,Memoriesea Women's Vintage Church Ruffle Sleeve Ruched Bodycon Work Midi Pencil Dress,35.991,4.7,31,0.340535498066748,1
B0CN854MLC,ASICS Men's Gel-Nimbus 26 Running Shoes,109.95309999999999,4.6,5,0.28850617579883886,1
B0CNGR3PSB,COOFANDY Mens Dress Pants Expandable Waist Wrinkle Free Suit Pants Flat Front Casual Dress Slacks,35.99,4.0,0,0.3830952381,1
B0CNXFQJZJ,EVALESS Womens Short Sleeve Textured Tops Crewneck Knit Solid Loose Casual Basic T Shirts Tee Blouses,9.5947,4.5,14,0.3308154638154638,1
B0CNXK4KRH,VATPAVE Mens Summer Striped Shirts Button Down Short Sleeve Vintage Beach Hawaiian Shirts with Pocket,19.99,4.7272727272727275,5,0.4201288936627282,1
B0CP3MWJVH,Dokotoo Women's 2025 Fashion Tops 3/4 Sleeve T-Shirts Cute Crewneck Basic Business Tees Blouses,14.99,4.5,42,0.3443626142376142,1
B0CP3NQCN3,Kaipiclos Newborn Infant Girl Clothes Rib Knit Romper Daisy Print Pants Headband Baby Clothes for Girls 0 3 6 12 18 24 Months,17.62,4.5,0,0.4195038136466708,1
B0CP5M161C,ANRABESS Womens Boho Maxi Dresses 2025 Summer V Neck Puff Sleeve Floral Flowy Swing Casual Long Dress,28.7928,4.5,83,0.34465782723345745,1
B0CP7277PW,Adokoo Canvas Tennis Shoes for Women Low Top Casual White Black Sneakers for Women Lace Up Fashion Comfortable Walking Shoes,10.995,4.7,40,0.2658138053467,1
B0CPF94HN3,Men's Navy Blue Silk Blend Sherwani Set | Imported Fabric Designer Indowestern and Pant style Pyjama,0.0,2.0,0,-0.413333333,0
B0CPHKY9MT,PRETTYGARDEN Womens Summer Jumpsuits Dressy Casual One Piece Outfits Sleeveless Mock Neck Wide Leg Pants Rompers with Pockets,39.995,4.5,103,0.2831145382395382,1
B0CPQS2BBR,Hey Dude Wendy Slip Classic | Women's Shoes | Women's Slip On Loafers | Comfortable & Light-Weight,59.998000000000005,4.7,6,0.3471632275132275,1
B0CQ1MZ1FP,adidas Men's Adi Advantage Golf Shorts,26.2856,4.4,5,0.33957491477344415,1
B0CQ4Q7SNQ,Dokotoo Summer Dress Casual Womens Fashion Short Sleeve Maxi Dress T Shirt Dress Striped Long Color Block Maxi Dress,31.986,4.7,17,0.39843840048840046,1
B0CQ8K495D,Women's Bodycon Pencil Dress Church Teacher Office Modest Business Wear to Work Sheath Suiting Dresses,39.99,4.4,19,0.3480784631701299,1
B0CQG4FZ5M,SIRIL Women's Crepe Printed Straight Kurta Set with Dupatta,0.0,3.8,4,0.4154761904761905,1
B0CQL15PMH,OFEEFAN Womens T Shirts Short Sleeve Pleated Dressy Casual Scooped Neck Summer Tops Blouses,12.993500000000001,4.4,53,0.3183787915127201,1
B0CQLQLWXL,COOFANDY Men's Button Down Shirts Short Sleeve Casual Shirts Summer Beach Shirts Vacation Wedding Shirts with Pocket,29.99,4.7,0,0.4676839826839826,1
B0CQT39CX5,ZESICA Women's Short Sleeve V Neck T Shirts 2025 Summer Ribbed Knit Slim Fitted Basic Solid Color Tee Tops,14.993500000000001,4.6,5,0.3491265752765752,1
B0CQTCDJJ7,M MAELREG Golf Shirts for Men Dry fit Sports Jacquard Lightweight Performance Texture Short Sleeve Collared Polo Shirts,28.95,4.6,0,0.48044047619047614,1
B0CQTL7R2J,Brooks Men’s Adrenaline GTS 24 Supportive Running Shoe,139.95,4.7,24,0.2901706349206349,1
B0CQY7PMMK,TACVASEN Mens Polo Golf Shirts with Pocket Pique Cooling Performance Moisture Wicking Polo Shirts,19.982,4.5,0,0.27184170587980117,1
B0CRB1NJ46,QINSEN Womens Square Neck Tennis Dress Short Sleeve Built in Shorts Golf Athletic Dress with Pockets,36.99,4.75,2,0.15843788156288155,1
B0CRHF41F7,5 Pack Athletic Gym Mens Shorts - Workout Black Quick Dry Basketball Shorts with Pockets for Running Casual Activewear,27.051499999999997,4.8,5,0.35595471306471305,1
B0CRHRSTZW,HILEELANG Kids Boy Basic Plain Cotton T-Shirts Short Sleeve Crew Neck Summer Tees 4packs 6-12 Years,18.99,4.0,0,0.2334137286102564,1
B0CRKRXPB6,BTFBM Women's Ruched Bodycon Dress Summer Casual Sleeveless Back Slit Elegant Club Evening Party Cocktail Maxi Dresses,44.99,4.5,50,0.2643597560177917,1
B0CRRF28SH,3 Pack Gym Basketball Mens Shorts - Quick Dry Black Workout Athletic Shorts with Pockets for Casual Running (S-6XL),18.9927,4.5,3,0.3214283008658009,1
B0CS2YYTM4,"Hey Dude Wally Stretch Sox, Men’s Shoes, Men's Slip-on Loafers, Comfortable & Light-Weight",58.0311,5.0,5,0.41176835318571425,1
B0CS69YKZQ,Men's Polo Shirts 2025 Short Sleeve Casual Polo T Shirt Color Block Slim Fit Golf Shirts with Pocket,19.9917,3.6,0,0.32594474968888887,1
B0CSG34RQS,"KISAH Men's Kurta Indo Western Sherwani Trouser Set, Navy Blue Jacquard, Woven Regular Fit| Traditional Wear for Men",0.0,1.0,0,0.1499999999999999,0
B0CSJ417P3,5 Pack Mesh Workout Shirts for Men Dry Fit Gym Shirts Quick Dry Athletic Short Sleeve T-Shirt Moisture Wicking,19.999,5.0,0,0.1119047619047618,1
B0CSK8H46P,AUTOMET Womens Summer Tops Spring Shirts Trendy Vacation Outfits Short Sleeve Business Tshirts Fashion Casual Blouses,11.99,4.6,52,0.3341876300759538,1
B0CSQGX6CZ,Wrangler Authentics Authentics Men's Flat Front Short,21.99,4.6,4,0.1642361111222222,1
B0CSWGBR4L,1/5 Pack Running Shirts Men Sport Tops Dry Fit Gym Wicking Athletic T Shirts Breathable Cool Workout Shirts,23.99,4.818181818181818,3,0.38042453947567584,1
B0CT3HL8KK,"3 Pack Mens Athletic Sweatpants with Zipper Pockets,Workout Gym Joggers Pants for Men Running Jogging Pants",45.99,4.8,13,0.33481990421586694,1
B0CT5QSZJ5,Blooming Jelly Womens Summer Tank Top Sleeveless Business Casual Outfits 2025 Basic Loose Dressy Work Shirt,14.99,4.7,32,0.3957335072335072,1
B0CTZZP8LN,Women's Light Green Floral Printed Cotton Straight Kurta,26.423700000000004,4.9,0,0.4179284188034188,1
B0CV3JSJW8,Womens Tops Casual 3/4 Sleeve Shirts Crew Neck Loose Casual Blouses Floral Print Tshirts,16.99,4.8,9,0.37975919913419914,1
B0CW39BXTQ,COOFANDY Mens Short Sleeve Casual Button Down Shirts Summer Untucked Dress Shirts with Pocket,19.992,4.4,12,0.25780059525714283,1
B0CW3JYMFM,Women's Heavy Cotton Thread & Sequence Embroidery Work Unstitched Salwar Suit Dress Material With Chanderi Sequence Work Dupatta (DM Fighter Cream_Cream_Free Size),34.88,5.0,2,0.1444444444444444,1
B0CW9NBPKZ,Unisex Baby Bodysuits Multipacks – Super Soft Cotton One-Piece Undershirt for Newborns and Infants (0-24 Months),20.99,5.0,0,0.33194444444444443,1
B0CXDL2NP6,OYGSieg 6 Pack Mens Polo Shirts Performance Short Sleeve Golf Shirt Moisture Wicking Athletic Casual Collared T-Shirt,48.99,4.6,14,0.4115413330056187,1
B0CXY1H4NG,Ethnic Junction Women's Art Silk Cotton Kalamkari Print Saree With Blouse Piece,20.4,4.5,7,0.1746212121212121,1
B0CY29F6G4,"Toddler Boys Shirts Short-Sleeve Little Kids t Shirts Boys' Tops, Tees & Shirts Graphic TEE Age for 2-7 Years 4-Pack",24.98,4.8,0,0.23096861471861468,1
B0CYC659P1,AUTOMET Womens Summer Tops Going Out Workout Outfits Spring T Shirts Business Casual Dressy Fashion Trendy Clothes 2025,9.99,4.6,32,0.24945206645206638,1
B0CYPN3HCB,KISAH Men's Jacquard Indowestern Sherwani Pajama Set – Mandarin Collar | Indian Wedding & Festive Wear,149.99,4.375,0,0.525327380952381,1
B0D1B42GVJ,Mens Running Shoes Fashion Sneakers Tennis Walking Shoes Lightweight Athletic Gym Workout Shoes,22.76,4.1,4,0.2666840277777777,1
B0D1H1HV5F,AEROPOSTALE Women's Aero High Waisted Jegging,49.959,5.0,0,0.4020833333333333,1
B0D1H3W5K7,AEROPOSTALE Men's Polo,11.996,4.8,7,0.32970493200612244,1
B0D266SMGD,1/5 Pack Workout Shirts for Men Athletic Running Gym Quick Dry Short Sleeve Performance Moisture Wicking T Shirt,19.9913,4.9,7,0.34761990324490327,1
B0D2HTM4XW,"Women's Latest Chiffon Batik Printed Saree with Blouse Piece, Light Blue, White, One Size, Light Blue, White, One Size",45.99,2.9,8,0.09587499999999997,1
B0D2JCJRFT,Handcraft Mens Underwear Funny Gifts for Men Chucky Cookie Monster Rick and Morty Scooby Doo Tom and Jerry Boxers for Men,16.99,4.9,0,0.4335728785103785,1
B0D2QBLKD5,Dokotoo Women's Tops Dressy Casual V Neck Long Sleeve Buttons Hollow Out Lace Embroidered Blouses Shirts,19.999,4.4,23,0.3729220779220779,1
B0D3659J5K,JOYNÉE 20 Pairs Mens No Show Socks Low Cut Ankle Socks Short Casual Socks,25.99,5.0,0,0.36666666666666664,1
B0D36NX7KC,Dickies Men's Original 874 Work Pants,29.99,3.9,23,0.1861618175475318,1
B0D38YFY3K,ZENGVEE Mens Polo Shirts Moisture Wicking Short Sleeve Performance Quick Dry Athletic Golf Shirts,42.99,4.2,0,0.20813622885051455,1
